date,username,tweet,location
2022-12-28 06:09:34,NusantaraSetya,@Tita83079013 @aniesbaswedan Anies emang sesat,DKI JAKARTA
2022-12-27 23:35:25,mung_paryono,@LANGKAHANIES @aniesbaswedan @bos_sir Ooooo... Yang sekarang namanya Yohanes Anis Rasid Baswedan Singh itu ya...,DKI JAKARTA
2022-12-27 23:24:09,Lambe_Nggambleh,"Anies Bawesdan Kunjungi Pasar Gede Solo, Sunyi Sepi Fans Anies Kadrun Pada Sembunyi #aniesbaswedan #Trending #Trendingtopic #viral #lambenggamblehjogja    https://t.co/fPCx03AWgN  https://t.co/FuVgjEHQnQ",DKI JAKARTA
2022-12-27 21:56:48,iwandermawan63,@Metro_TV @infoBMKG Ya curah hujan ekstrim...istilah zaman @aniesbaswedan ... Sering terlontar....semoga tidak sebesar itu ...malah mengecil....amin,DKI JAKARTA
2022-12-27 21:41:35,Kevin_ant5,@aniesbaswedan @feryfarhati  https://t.co/qGkX0hhhkA,DKI JAKARTA
2022-12-27 20:49:06,TeguhSudarisman,"@ch_chotimah2 ""Maafkan aku mengecewakanmu, Mas Kus,"" kata @aniesbaswedan. ""Teruslah nyinyir meski nggak berguna."" 💪💪  https://t.co/YVdHGwsrsc",DKI JAKARTA
2022-12-27 20:29:28,masochim,Masih ingatkah kau yohanes @aniesbaswedan ..? Dasar munafiq  https://t.co/Wb2pkx3XvG,DKI JAKARTA
2022-12-27 20:10:19,RencangAH,Udah tau kan siapa yang jadi pilihan rakyat ? #kerjauntukindonesia #GolkarIndonesia #airlanggahartarto #Pilpres #Pilpres2024 #Pemilu #aniesbaswedan @airlangga_hrt @Golkar2024 @golkar_id @PemimpinBangsa3 @CaryaAirlangga @KoncoAirlangga @putuagenggribig @CapresGolkar  https://t.co/tWSCC54zvy,DKI JAKARTA
2022-12-27 20:07:04,masochim,Rakyat sudah cerdas dan bisa bedain mana yg bisa kerja dan mana yg biasa berbohong. Bukan begitu Yohanes @aniesbaswedan,DKI JAKARTA
2022-12-27 20:02:03,masochim,Ngebacot aja lu nies @aniesbaswedan,DKI JAKARTA
2022-12-27 19:57:19,Nawawi079,"@NasDem Tolong pasang spanduk di daerah Jagakarsa, khususnya Srengseng sawah, foto @aniesbaswedan dan lambang Parpol NasDem",DKI JAKARTA
2022-12-27 19:51:07,Junz_backup,@petruspasaribuu @aniesbaswedan @prabowo @Gerindra Lain diucap lain pula yg dilakukan.,DKI JAKARTA
2022-12-27 19:27:12,money_muffins,"Jangan kan ngomong, Anies Baswedan diamnya pun dustai  #HTIFPIDukungAnies #AniesDidukungKHILAFAH #AniesNasdemOut  #TenggelamkanAniesBaswedan #TenggelamkanPartaiNasdem #GoodByeNasdemAnies #AniesDidukungKoruptor #AniesPendukungKhilafah #AniesPendukungOrmasRadikal  https://t.co/Gj0KMin4Gt",DKI JAKARTA
2022-12-27 19:24:36,money_muffins,Ternyata Rizieq Shihab Hasut Jamaah MPI Lampung di Rumahnya Petamburan agar mendukung Anies Baswedan  #HTIFPIDukungAnies #AniesDidukungKHILAFAH #AniesNasdemOut #TenggelamkanAniesBaswedan #TenggelamkanPartaiNasdem #GoodByeNasdemAnies #AniesDidukungKoruptor #AniesPendukungKhilafah  https://t.co/ruokROPYTp,DKI JAKARTA
2022-12-27 19:15:53,GeryNelwan,Anies seorang yang intoleran dan radikal - Tolak Anies Baswedan - #HTIFPIDukungAnies #AniesDidukungKHILAFAH #AniesNasdemOut  #TenggelamkanAniesBaswedan #TenggelamkanPartaiNasdem #GoodByeNasdemAnies #AniesDidukungKoruptor #AniesPendukungKhilafah #AniesPendukungOrmasRadikal  https://t.co/Aqhu8OQOpU,DKI JAKARTA
2022-12-27 19:15:31,herfan03,"@WarasWareg @Mdy_Asmara1701 Track record berserak. Belum lama dari 2014, dia udah pernah berjanji ga akan copras capres, sejak kampanye pilgub dki sampe setelah menjabat dki-1. Saya yg bego aja bisa liat, masa org sepinter dia termasuk @aniesbaswedan bisa ketipu?",DKI JAKARTA
2022-12-27 19:15:09,GeryNelwan,Anies memecah belah bangsa dengan politik identitas Tolak Anies Baswedan #HTIFPIDukungAnies #AniesDidukungKHILAFAH #AniesNasdemOut  #TenggelamkanAniesBaswedan #TenggelamkanPartaiNasdem #GoodByeNasdemAnies #AniesDidukungKoruptor #AniesPendukungKhilafah #AniesPendukungOrmasRadikal  https://t.co/w7EqGptTSv,DKI JAKARTA
2022-12-27 19:14:53,GeryNelwan,"Jakarta hancur karena Anies, jangan mau ditipu lagi Tolak Anies Baswedan #HTIFPIDukungAnies #AniesDidukungKHILAFAH #AniesNasdemOut  #TenggelamkanAniesBaswedan #TenggelamkanPartaiNasdem #GoodByeNasdemAnies #AniesDidukungKoruptor #AniesPendukungKhilafah #AniesPendukungOrmasRadikal  https://t.co/ZNjpXG9Eip",DKI JAKARTA
2022-12-27 19:14:09,GeryNelwan,Waspada Anies bersama simpatisan ormas terlarang - Tolak Anies Baswedan - #HTIFPIDukungAnies #AniesDidukungKHILAFAH #AniesNasdemOut  #TenggelamkanAniesBaswedan #TenggelamkanPartaiNasdem #GoodByeNasdemAnies #AniesDidukungKoruptor #AniesPendukungKhilafah #AniesPendukungOrmasRadikal  https://t.co/2b989XqZpz,DKI JAKARTA
2022-12-27 19:13:59,GeryNelwan,"Anies otak udang, budak kelompok radikal - Tolak Anies Baswedan - #HTIFPIDukungAnies #AniesDidukungKHILAFAH #AniesNasdemOut  #TenggelamkanAniesBaswedan #TenggelamkanPartaiNasdem #GoodByeNasdemAnies #AniesDidukungKoruptor #AniesPendukungKhilafah #AniesPendukungOrmasRadikal  https://t.co/Cxks12rIyP",DKI JAKARTA
2022-12-27 19:05:48,mariakartika55,Tolak keberadaan safari politik Anies Baswedan dimanapun. rakyat tidak butuh sosok Anies #HTIFPIDukungAnies #AniesDidukungKHILAFAH #AniesNasdemOut  #TenggelamkanAniesBaswedan #TenggelamkanPartaiNasdem #GoodByeNasdemAnies #AniesPendukungOrmasRadikal #PribumiLebihBerkualitas  https://t.co/qtjgFEPP2P,DKI JAKARTA
2022-12-27 18:00:25,Junz_backup,@doelpaten @anton_istianto @AkuAtikaFaya @aniesbaswedan @bachrum_achmadi @marlina_idha @Mdy_Asmara1701 @tatakujiyati Giliran ke Pak Jokowi kalian Cap KAFIR  Kadrun selalu pake Standar Ganda.,DKI JAKARTA
2022-12-27 17:33:07,angaripin,@lapen_mocca78 @tkngkbb @aniesbaswedan Yohanes anis baswedan  https://t.co/nsit9qzbUM,DKI JAKARTA
2022-12-27 16:44:02,Junz_backup,@alu_gara @ZulaikaSugiarto @Sukardi2017 @aniesbaswedan Sdh lain lg...skrg Yohanes,DKI JAKARTA
2022-12-27 16:31:30,UjangHaerudin12,@Sukardi2017 @aniesbaswedan  https://t.co/zxHieg6kht,DKI JAKARTA
2022-12-27 15:46:40,YAPSKH72,"Hallo Pak Yohanes, gelar baru nih @aniesbaswedan",DKI JAKARTA
2022-12-27 11:52:47,tempebalado7,@YakinNazara @ingatturu @aniesbaswedan Makin goblok,DKI JAKARTA
2022-12-27 11:46:13,NusantaraSetya,@Tita83079013 @aniesbaswedan Luwar biasa ngawurnya,DKI JAKARTA
2022-12-27 11:27:20,Junz_backup,@doelpaten @AkuAtikaFaya @anton_istianto @aniesbaswedan @bachrum_achmadi @marlina_idha @Mdy_Asmara1701 @tatakujiyati Coba tampilkan kawasan bantaran sungai2 di DKI.  Kalo Kawasan Sudirman - Thamrin emang dah dari anda masih bentuk sperma encer sdh KEREN MEMANG.,DKI JAKARTA
2022-12-27 11:24:25,Chang67428409,"Kelompok radikal dukung Anies Baswedan,  . #HTIFPIDukungAnies #AniesDidukungKHILAFAH #AniesNasdemOut  #TenggelamkanAniesBaswedan #TenggelamkanPartaiNasdem #GoodByeNasdemAnies #AniesDidukungKoruptor #AniesPendukungKhilafah #AniesPendukungOrmasRadikal #PribumiLebihBerkualitas",DKI JAKARTA
2022-12-27 11:23:50,Chang67428409,Anies Baswedan memang gila kekuasaan . #HTIFPIDukungAnies #AniesDidukungKHILAFAH #AniesNasdemOut  #TenggelamkanAniesBaswedan #TenggelamkanPartaiNasdem #GoodByeNasdemAnies #AniesDidukungKoruptor #AniesPendukungKhilafah #AniesPendukungOrmasRadikal #PribumiLebihBerkualitas,DKI JAKARTA
2022-12-27 11:13:20,Junz_backup,"@doelpaten @AkuAtikaFaya @anton_istianto @aniesbaswedan @bachrum_achmadi @marlina_idha @Mdy_Asmara1701 @tatakujiyati Iya, percaya  https://t.co/l0cB5CB0Wj",DKI JAKARTA
2022-12-27 10:34:20,GeryNelwan,Anies kinerjanya bobrok hancur berantakan - Tolak Anies Baswedan - #HTIFPIDukungAnies #AniesDidukungKHILAFAH #AniesNasdemOut  #TenggelamkanAniesBaswedan #TenggelamkanPartaiNasdem #GoodByeNasdemAnies #AniesDidukungKoruptor #AniesPendukungKhilafah #AniesPendukungOrmasRadikal  https://t.co/0qSqOPxQBb,DKI JAKARTA
2022-12-27 10:34:08,GeryNelwan,Anies radikal dan diperbudak kelompok terlarang - Tolak Anies Baswedan - #HTIFPIDukungAnies #AniesDidukungKHILAFAH #AniesNasdemOut  #TenggelamkanAniesBaswedan #TenggelamkanPartaiNasdem #GoodByeNasdemAnies #AniesDidukungKoruptor #AniesPendukungKhilafah #AniesPendukungOrmasRadikal  https://t.co/mVT8GrYDog,DKI JAKARTA
2022-12-27 10:33:58,GeryNelwan,Anies seorang yang intoleran dan radikal - Tolak Anies Baswedan - #HTIFPIDukungAnies #AniesDidukungKHILAFAH #AniesNasdemOut  #TenggelamkanAniesBaswedan #TenggelamkanPartaiNasdem #GoodByeNasdemAnies #AniesDidukungKoruptor #AniesPendukungKhilafah #AniesPendukungOrmasRadikal  https://t.co/vbZSf7HEMw,DKI JAKARTA
2022-12-27 10:33:48,GeryNelwan,Anies manusia perusak dan pembawa bencana bagi NKRI Tolak Anies Baswedan #HTIFPIDukungAnies #AniesDidukungKHILAFAH #AniesNasdemOut  #TenggelamkanAniesBaswedan #TenggelamkanPartaiNasdem #GoodByeNasdemAnies #AniesDidukungKoruptor #AniesPendukungKhilafah #AniesPendukungOrmasRadikal  https://t.co/9yLbTw9wTm,DKI JAKARTA
2022-12-27 10:33:19,GeryNelwan,Anies hanya akan membawa perpecahan &amp; kehancuran - Tolak Anies Baswedan - #HTIFPIDukungAnies #AniesDidukungKHILAFAH #AniesNasdemOut  #TenggelamkanAniesBaswedan #TenggelamkanPartaiNasdem #GoodByeNasdemAnies #AniesDidukungKoruptor #AniesPendukungKhilafah #AniesPendukungOrmasRadikal  https://t.co/vVUQZBwcOK,DKI JAKARTA
2022-12-27 10:32:55,GeryNelwan,Anies ditolak keras oleh berbagai lapisan warga - Tolak Anies Baswedan - #HTIFPIDukungAnies #AniesDidukungKHILAFAH #AniesNasdemOut #TenggelamkanAniesBaswedan #TenggelamkanPartaiNasdem #GoodByeNasdemAnies #AniesDidukungKoruptor #AniesPendukungKhilafah #AniesPendukungOrmasRadikal  https://t.co/OguYcyE5Fb,DKI JAKARTA
2022-12-27 10:32:43,GeryNelwan,Waspada kehadiran Anies membawa kehancuran - Tolak Anies Baswedan - #HTIFPIDukungAnies #AniesDidukungKHILAFAH #AniesNasdemOut  #TenggelamkanAniesBaswedan #TenggelamkanPartaiNasdem #GoodByeNasdemAnies #AniesDidukungKoruptor #AniesPendukungKhilafah #AniesPendukungOrmasRadikal  https://t.co/Uy6f8fXjKY,DKI JAKARTA
2022-12-27 10:32:34,GeryNelwan,Anies budak dari ormas radikal - Tolak Anies Baswedan - #HTIFPIDukungAnies #AniesDidukungKHILAFAH #AniesNasdemOut  #TenggelamkanAniesBaswedan #TenggelamkanPartaiNasdem #GoodByeNasdemAnies #AniesDidukungKoruptor #AniesPendukungKhilafah #AniesPendukungOrmasRadikal  https://t.co/VIWG3Qu0cC,DKI JAKARTA
2022-12-27 10:22:55,BakomstraTGalek,Demokrat Sebut Mayoritas Konstituen Inginkan Duet Anies Baswedan - AHY di 2024 #PartaiDemokrat #AHYPimpinPerubahan  https://t.co/zz6jUyosa4,DKI JAKARTA
2022-12-27 10:21:48,BakomstraTGalek,Duet Anies Baswedan - AHY di 2024 #PartaiDemokrat #AHYPimpinPerubahan  https://t.co/zz6jUyosa4,DKI JAKARTA
2022-12-27 10:19:52,JohnCalifer,Bapak politim identitas Anies Baswedan #HTIFPIDukungAnies #AniesDidukungKHILAFAH #AniesNasdemOut  #TenggelamkanAniesBaswedan #TenggelamkanPartaiNasdem #GoodByeNasdemAnies #AniesDidukungKoruptor #AniesPendukungKhilafah #AniesPendukungOrmasRadikal #PribumiLebihBerkualitas  https://t.co/ULt5ZncyAp,DKI JAKARTA
2022-12-27 09:52:22,BoogieBear1318,MPI Lampung adalah Jelmaan Kelompok HTI atau FPI Yang terlibat Kontrak Politik dengan Anies Baswedan  #HTIFPIDukungAnies #AniesDidukungKHILAFAH #AniesNasdemOut  #TenggelamkanAniesBaswedan #TenggelamkanPartaiNasdem #GoodByeNasdemAnies #AniesDidukungKoruptor #AniesPendukungKhilafah  https://t.co/sCtHfNK6vb,DKI JAKARTA
2022-12-27 09:44:13,IndosatF,Anies Baswedan buruk ga ada prestasinya bodoh #HTIFPIDukungAnies #AniesDidukungKHILAFAH #AniesNasdemOut  #TenggelamkanAniesBaswedan #TenggelamkanPartaiNasdem #GoodByeNasdemAnies #AniesDidukungKoruptor #AniesPendukungKhilafah #AniesPendukungOrmasRadikal #PribumiLebihBerkualitas  https://t.co/QjVe9rPnME,DKI JAKARTA
2022-12-27 08:03:34,sugito43334255,@QaillaAsyiqah @aniesbaswedan galak waktu kurus  https://t.co/rCVxq4QdQz,DKI JAKARTA
2022-12-27 06:02:52,goesnie2,@ifull1934 @andryanz12 @aniesbaswedan Pekai senang agama satu dan agama lainnya beseteru.lah,DKI JAKARTA
2022-12-27 05:39:41,KakangP48188441,Ouhh begono ya @aniesbaswedan,DKI JAKARTA
2022-12-26 20:16:06,Dionbonjovi181,@LANGKAHANIES @aniesbaswedan @bos_sir Nasdrun fix ambyarrrrr😂😂  https://t.co/YBHkKSsass,DKI JAKARTA
2022-12-26 19:46:37,money_muffins,"Wan Anies didukung Simpatisan FPI dan HTI, TENGGELAMKAN ANIES BASWEDAN  #HTIFPIDukungAnies #AniesDidukungKHILAFAH #AniesNasdemOut  #TenggelamkanAniesBaswedan #TenggelamkanPartaiNasdem #GoodByeNasdemAnies #AniesDidukungKoruptor #AniesPendukungKhilafah #AniesPendukungOrmasRadikal  https://t.co/6uUCBVpUq2",DKI JAKARTA
2022-12-26 19:05:18,dharmaofficiall,"@QaillaAsyiqah @aniesbaswedan Kasihan mereka... udah demo ujan-ujanan, ngak dibayar pula (katanya uang demo dibawa kabur koordinator)",DKI JAKARTA
2022-12-26 19:04:48,GeryNelwan,Waspada ! Anies seorang yang intoleran dan radikal Tolak Anies Baswedan #HTIFPIDukungAnies #AniesDidukungKHILAFAH #AniesNasdemOut  #TenggelamkanAniesBaswedan #TenggelamkanPartaiNasdem #GoodByeNasdemAnies #AniesDidukungKoruptor #AniesPendukungKhilafah #AniesPendukungOrmasRadikal  https://t.co/ghFTgwcqhp,DKI JAKARTA
2022-12-26 19:03:46,GeryNelwan,Anies memecah belah bangsa dengan politik identitas Tolak Anies Baswedan #HTIFPIDukungAnies #AniesDidukungKHILAFAH #AniesNasdemOut  #TenggelamkanAniesBaswedan #TenggelamkanPartaiNasdem #GoodByeNasdemAnies #AniesDidukungKoruptor #AniesPendukungKhilafah #AniesPendukungOrmasRadikal  https://t.co/Lu600F9ZbD,DKI JAKARTA
2022-12-26 19:03:11,GeryNelwan,Waspada Anies bersama simpatisan ormas terlarang - Tolak Anies Baswedan - #HTIFPIDukungAnies #AniesDidukungKHILAFAH #AniesNasdemOut  #TenggelamkanAniesBaswedan #TenggelamkanPartaiNasdem #GoodByeNasdemAnies #AniesDidukungKoruptor #AniesPendukungKhilafah #AniesPendukungOrmasRadikal  https://t.co/PQzhEzBxp5,DKI JAKARTA
2022-12-26 19:03:01,GeryNelwan,"Anies otak udang, budak kelompok radikal - Tolak Anies Baswedan - #HTIFPIDukungAnies #AniesDidukungKHILAFAH #AniesNasdemOut  #TenggelamkanAniesBaswedan #TenggelamkanPartaiNasdem #GoodByeNasdemAnies #AniesDidukungKoruptor #AniesPendukungKhilafah #AniesPendukungOrmasRadikal  https://t.co/nmoVw07wwP",DKI JAKARTA
2022-12-26 18:01:36,danieldnl91,@MoTeeTee @BudTeguh @UyokBack @marlina_idha @Mdy_Asmara1701 @AndiSinulingga @abu_waras @ekowboy2 @bachrum_achmadi @NasDem @Relawananies @musniumar @aniesbaswedan @DediMulyadi71 duh 😂😂😂,DKI JAKARTA
2022-12-26 15:52:42,Justonedy2,@Sukardi2017 @aniesbaswedan Malah menerima di baptis dgn nama Yohanes Anis Baswedan.,DKI JAKARTA
2022-12-26 14:38:33,masmobit,"@QaillaAsyiqah @aniesbaswedan Keren, oratornya juga baca teks...",DKI JAKARTA
2022-12-26 13:40:37,bonank771,@Relawananies semoga pak @aniesbaswedan berduet dengan Kang @aheryawan aamiin betulkan @sobataher_ @PKSejahtera @PKSJaksel @pksjabar @PKSDKIJakarta bukan berpasangan dgn si @AgusYudhoyono ane  &amp;keluarga golput kalo berpasangan dengan si @AgusYudhoyono,DKI JAKARTA
2022-12-26 13:15:36,ANDI_DJUNAIDI,@aniesbaswedan @feryfarhati Hal yg sering dianggap sepele membawa oleh2 utk keluarga di rumah. Padahal ini salah satu yg bisa menambah keharmonisan.  #aniesbaswedan  #untukindonesia,DKI JAKARTA
2022-12-26 11:31:34,Chang67428409,Anies Baswedan otak curang !!!  . #HTIDukungAnies #AniesDidukungKHILAFAH #AniesNasdemOut  #TenggelamkanAniesBaswedan #TenggelamkanPartaiNasdem #GoodByeNasdemAnies #AniesDidukungKoruptor #AniesPendukungKhilafah #AniesPendukungOrmasRadikal,DKI JAKARTA
2022-12-26 11:17:50,SateMadura170,Warga Lakukan Aksi Demo Tolak Kedatangan Anies Baswedan #HTIFPIDukungAnies #AniesDidukungKHILAFAH #AniesNasdemOut  #TenggelamkanAniesBaswedan #TenggelamkanPartaiNasdem #GoodByeNasdemAnies #AniesDidukungKoruptor #AniesPendukungKhilafah #AniesPendukungOrmasRadikal  https://t.co/bAODB9FvAQ,DKI JAKARTA
2022-12-26 11:00:48,GeryNelwan,Warga Solo menolak kedatangan Anies yang membawa kampanye politik identitas - Tolak Anies Baswedan - #HTIFPIDukungAnies #AniesDidukungKHILAFAH #AniesNasdemOut  #TenggelamkanAniesBaswedan #TenggelamkanPartaiNasdem #GoodByeNasdemAnies #AniesDidukungKoruptor #AniesPendukungKhilafah  https://t.co/dZg6ItAq5i,DKI JAKARTA
2022-12-26 10:59:42,GeryNelwan,Anies ditolak mentah-mentah oleh masyarakat Solo - Tolak Anies Baswedan - #HTIFPIDukungAnies #AniesDidukungKHILAFAH #AniesNasdemOut  #TenggelamkanAniesBaswedan #TenggelamkanPartaiNasdem #GoodByeNasdemAnies #AniesDidukungKoruptor #AniesPendukungKhilafah #AniesPendukungOrmasRadikal  https://t.co/FYxG57dHtO,DKI JAKARTA
2022-12-26 10:59:33,GeryNelwan,Anies telah memberikan contoh yang buruk karena curi start kampanye - Tolak Anies Baswedan - #HTIFPIDukungAnies #AniesDidukungKHILAFAH #AniesNasdemOut  #TenggelamkanAniesBaswedan #TenggelamkanPartaiNasdem #GoodByeNasdemAnies #AniesDidukungKoruptor #AniesPendukungKhilafah  https://t.co/ry7DOM7ZeL,DKI JAKARTA
2022-12-26 10:59:10,GeryNelwan,Warga Solo menolak Anies si bapak politik identitas Tolak Anies Baswedan #HTIFPIDukungAnies #AniesDidukungKHILAFAH #AniesNasdemOut  #TenggelamkanAniesBaswedan #TenggelamkanPartaiNasdem #GoodByeNasdemAnies #AniesDidukungKoruptor #AniesPendukungKhilafah #AniesPendukungOrmasRadikal  https://t.co/LsD85dXMyR,DKI JAKARTA
2022-12-26 10:58:58,GeryNelwan,Surakarta tolak Anies Baswedan karena dia pemecah belah bangsa - Tolak Anies Baswedan - #HTIFPIDukungAnies #AniesDidukungKHILAFAH #AniesNasdemOut  #TenggelamkanAniesBaswedan #TenggelamkanPartaiNasdem #GoodByeNasdemAnies #AniesDidukungKoruptor #AniesPendukungKhilafah  https://t.co/1aMKQA1PGe,DKI JAKARTA
2022-12-26 10:53:43,ammarsuhada,@aniesbaswedan Selamat Natal pak,DKI JAKARTA
2022-12-26 09:29:20,Jay_Riesman66,"@algaruti80 @Ardi39514267 @marlina_idha Betul sekali ..., @aniesbaswedan emang pintar ..., pintar nilep anggaran, pintar retorika, pintar tatakata ...",DKI JAKARTA
2022-12-26 09:07:53,GeryNelwan,Anies kinerjanya bobrok hancur berantakan - Tolak Anies Baswedan - #HTIFPIDukungAnies #AniesDidukungKHILAFAH #AniesNasdemOut  #TenggelamkanAniesBaswedan #TenggelamkanPartaiNasdem #GoodByeNasdemAnies #AniesDidukungKoruptor #AniesPendukungKhilafah #AniesPendukungOrmasRadikal  https://t.co/rBKtHKOYwi,DKI JAKARTA
2022-12-26 09:07:12,GeryNelwan,Anies radikal dan diperbudak kelompok terlarang - Tolak Anies Baswedan - #HTIFPIDukungAnies #AniesDidukungKHILAFAH #AniesNasdemOut  #TenggelamkanAniesBaswedan #TenggelamkanPartaiNasdem #GoodByeNasdemAnies #AniesDidukungKoruptor #AniesPendukungKhilafah #AniesPendukungOrmasRadikal  https://t.co/69ntBrcVj1,DKI JAKARTA
2022-12-26 09:06:24,GeryNelwan,Anies seorang yang intoleran dan radikal - Tolak Anies Baswedan - #HTIFPIDukungAnies #AniesDidukungKHILAFAH #AniesNasdemOut  #TenggelamkanAniesBaswedan #TenggelamkanPartaiNasdem #GoodByeNasdemAnies #AniesDidukungKoruptor #AniesPendukungKhilafah #AniesPendukungOrmasRadikal  https://t.co/y8GDhG1hLG,DKI JAKARTA
2022-12-26 09:05:52,GeryNelwan,Anies manusia perusak dan pembawa bencana bagi NKRI Tolak Anies Baswedan #HTIFPIDukungAnies #AniesDidukungKHILAFAH #AniesNasdemOut  #TenggelamkanAniesBaswedan #TenggelamkanPartaiNasdem #GoodByeNasdemAnies #AniesDidukungKoruptor #AniesPendukungKhilafah #AniesPendukungOrmasRadikal  https://t.co/O1s4cgOtEk,DKI JAKARTA
2022-12-26 09:04:27,GeryNelwan,Anies hanya akan membawa perpecahan &amp; kehancuran - Tolak Anies Baswedan - #HTIFPIDukungAnies #AniesDidukungKHILAFAH #AniesNasdemOut  #TenggelamkanAniesBaswedan #TenggelamkanPartaiNasdem #GoodByeNasdemAnies #AniesDidukungKoruptor #AniesPendukungKhilafah #AniesPendukungOrmasRadikal  https://t.co/YCUmdzJ6hI,DKI JAKARTA
2022-12-26 09:04:04,GeryNelwan,Anies ditolak keras oleh berbagai lapisan warga - Tolak Anies Baswedan - #HTIFPIDukungAnies #AniesDidukungKHILAFAH #AniesNasdemOut #TenggelamkanAniesBaswedan #TenggelamkanPartaiNasdem #GoodByeNasdemAnies #AniesDidukungKoruptor #AniesPendukungKhilafah #AniesPendukungOrmasRadikal  https://t.co/xyOb9QSlRs,DKI JAKARTA
2022-12-26 09:03:57,GeryNelwan,Waspada kehadiran Anies membawa kehancuran - Tolak Anies Baswedan - #HTIFPIDukungAnies #AniesDidukungKHILAFAH #AniesNasdemOut  #TenggelamkanAniesBaswedan #TenggelamkanPartaiNasdem #GoodByeNasdemAnies #AniesDidukungKoruptor #AniesPendukungKhilafah #AniesPendukungOrmasRadikal  https://t.co/h82yVG7jLB,DKI JAKARTA
2022-12-26 09:03:47,GeryNelwan,Anies budak dari ormas radikal gak bisa kerja - Tolak Anies Baswedan - #HTIFPIDukungAnies #AniesDidukungKHILAFAH #AniesNasdemOut  #TenggelamkanAniesBaswedan #TenggelamkanPartaiNasdem #GoodByeNasdemAnies #AniesDidukungKoruptor #AniesPendukungKhilafah #AniesPendukungOrmasRadikal  https://t.co/0sGvOSbT9Y,DKI JAKARTA
2022-12-26 08:36:38,IndosatF,Banjir dimana mana Anies Baswedan tidak ada prestasi alias bodoh #HTIFPIDukungAnies #AniesDidukungKHILAFAH #AniesNasdemOut  #TenggelamkanAniesBaswedan #TenggelamkanPartaiNasdem #GoodByeNasdemAnies #AniesDidukungKoruptor #AniesPendukungKhilafah #AniesPendukungOrmasRadikal  https://t.co/3lJxVsnB9K,DKI JAKARTA
2022-12-26 08:36:19,IndosatF,Bnyak omong Anies Baswedan tidak ada prestasi alias bodoh #HTIFPIDukungAnies #AniesDidukungKHILAFAH #AniesNasdemOut  #TenggelamkanAniesBaswedan #TenggelamkanPartaiNasdem #GoodByeNasdemAnies #AniesDidukungKoruptor #AniesPendukungKhilafah #AniesPendukungOrmasRadikal  https://t.co/9zO3dN2SFM,DKI JAKARTA
2022-12-26 08:35:58,IndosatF,5 tahun dijakarta gada hasil Anies Baswedan tidak ada prestasi alias bodoh #HTIFPIDukungAnies #AniesDidukungKHILAFAH #AniesNasdemOut  #TenggelamkanAniesBaswedan #TenggelamkanPartaiNasdem #GoodByeNasdemAnies #AniesDidukungKoruptor  https://t.co/Ejk3qHEpPF,DKI JAKARTA
2022-12-26 08:35:48,IndosatF,Anies bapak politik Anies Baswedan tidak ada prestasi alias bodoh #HTIFPIDukungAnies #AniesDidukungKHILAFAH #AniesNasdemOut  #TenggelamkanAniesBaswedan #TenggelamkanPartaiNasdem #GoodByeNasdemAnies #AniesDidukungKoruptor #AniesPendukungKhilafah  https://t.co/x6F4Sfr9qO,DKI JAKARTA
2022-12-26 08:35:17,IndosatF,Salah satu karya anies Anies Baswedan tidak ada prestasi alias bodoh #HTIFPIDukungAnies #AniesDidukungKHILAFAH #AniesNasdemOut  #TenggelamkanAniesBaswedan #TenggelamkanPartaiNasdem #GoodByeNasdemAnies #AniesDidukungKoruptor  https://t.co/9f5uvnX9X6,DKI JAKARTA
2022-12-26 08:34:57,IndosatF,Anies Baswedan tidak ada prestasi alias bodoh #HTIFPIDukungAnies #AniesDidukungKHILAFAH #AniesNasdemOut  #TenggelamkanAniesBaswedan #TenggelamkanPartaiNasdem #GoodByeNasdemAnies #AniesDidukungKoruptor #AniesPendukungKhilafah #AniesPendukungOrmasRadikal #PribumiLebihBerkualitas  https://t.co/1HV1mokArn,DKI JAKARTA
2022-12-26 08:34:53,IndosatF,Tidak berbuat apa apa Anies Baswedan tidak ada prestasi alias bodoh #HTIFPIDukungAnies #AniesDidukungKHILAFAH #AniesNasdemOut  #TenggelamkanAniesBaswedan #TenggelamkanPartaiNasdem #GoodByeNasdemAnies #AniesDidukungKoruptor #AniesPendukungKhilafah #AniesPendukungOrmasRadikal  https://t.co/uICs50Vcgs,DKI JAKARTA
2022-12-26 08:34:39,IndosatF,Banyak bacot Anies Baswedan tidak ada prestasi alias bodoh #HTIFPIDukungAnies #AniesDidukungKHILAFAH #AniesNasdemOut  #TenggelamkanAniesBaswedan #TenggelamkanPartaiNasdem #GoodByeNasdemAnies #AniesDidukungKoruptor #AniesPendukungKhilafah #AniesPendukungOrmasRadikal #PribumiLebih  https://t.co/1iSbXvykFO,DKI JAKARTA
2022-12-26 08:09:50,Nasrullah_PD,@aniesbaswedan semoga amalan beliau diterima.....,DKI JAKARTA
2022-12-26 07:53:43,yudar30,Kita perjuangkan agar Anies  Baswedan menjadi pemimpin dgn tekad perubahan.lepas dr cengkraman oligarki yg jelas menyengsarakan rakyat memperkaya yg menghisap sumber dana dan alam Indonesia hanya utk golongan mrk .,DKI JAKARTA
2022-12-26 06:45:56,maulidin_ahmat,"@BukanRajaNgibul @arivpermana @Sauki_Futaki @R_min80 @aniesbaswedan Iy bng, itu gw zoom, SS dkit, biar bpk yg sibuk kerja ini tau, kalo fto yg d kirim gerombolannya adalh hoax...",DKI JAKARTA
2022-12-26 06:38:02,Junz_backup,@kangdede78 @aniesbaswedan Wow...Yohanies Baswedan jd pengikut Sexte🤭🙈,DKI JAKARTA
2022-12-26 06:27:42,maulidin_ahmat,"@arivpermana @BukanRajaNgibul @Sauki_Futaki @R_min80 @aniesbaswedan Sambil kerja, sambil ngecek gambar ini bisa ya pak. Udah saya zoom trus SS dkit, biar jelas... 🙏😊  https://t.co/2UgQef48On",DKI JAKARTA
2022-12-26 06:25:41,maulidin_ahmat,"@abiskesuspen @arivpermana @R_min80 @aniesbaswedan Bapak ibu cebong saudaraku, tlg, kpan"" Kalo bkin hoax pinter dikit editannya, minimal agak rapi lah, biar gk menunjukkan kepintaran kalian yg d bawah rata""... 😊🙏  https://t.co/AKz4ApV9yE",DKI JAKARTA
2022-12-26 06:04:07,iKhalis,Saya saksi penerima BOTI yang terstruktur dan sistematis. Kontrol dan pencairan melibatkan lembaga Masjid dan Lembaga ibadah lainnya secara kolaboratif.  Kalau ada yg blg @aniesbaswedan intoleran fix dia nggak tinggal di @DKIJakarta atau numpang tinggal tapi #toxiccomunity,DKI JAKARTA
2022-12-26 01:49:49,HabibMu50362599,@aniesbaswedan @NasDem @NasDem_Sulsel77 KORUPTOR ITU PKI LAKNAT &amp; OLIGARKI SERAKAH BIADAB   https://t.co/jYfhe9Rzsq,DKI JAKARTA
2022-12-26 00:57:57,NurulAeni1190,#aniesbaswedan #ridwankamil #sandiagauno #jokowi #capres #cawapres #puanmaharani #cakimin  #indonesia #exploresukabumi #kotasukabumi #infosukabumi #visitcianjur #sukabumitoday #explorecianjur #infocianjur #ciracap #caringin #cibadak #cisaat,DKI JAKARTA
2022-12-26 00:08:13,Nasrullah_PD,@aniesbaswedan aminn,DKI JAKARTA
2022-12-25 21:27:42,CarrieLayangan,Jakrta hancur ditangan Anies Baswedan! #HTIFPIDukungAnies #AniesDidukungKHILAFAH #TenggelamkanAniesBaswedan #GoodByeNasdemAnies #AniesDidukungKoruptor #AniesPendukungKhilafah #AniesPendukungOrmasRadikal #PribumiLebihBerkualitas  https://t.co/NzH5MIS3j4,DKI JAKARTA
2022-12-25 20:21:08,masdwika,@agungmozin @Matahari_1912 @RadarKorupsi @uusbustami @paidjo2018 @IiiZahrah @CindyBexter @mueeza02 @basela71008 @k4yyona_ @yaminhariyanto @Patiunus14 @DrEvaChaniago @DrTaufan1 @CutSarina5 @effzar_za @nugrohost7 @HerrySuryya @DjudjuP @Mdy_Asmara1701 @IJM @HRF @HeriMaryadi15 @msaid_didu @MichelAdam5l5 @AgusYudhoyono @MuhammadJafarK4 @FPD_DPR @LAZARUSCHAKWERA @dr_koko28 @democrazymedia @resep_JSR @Fatah_drSPM @BanggaKadrun @FPKSDPRRI @RiswanHaris212 @liem_id @suryapaloh18 @NasDem @PDemokrat @aniesbaswedan @susno2g @MSKaban3 @BennyHarmanID @hincapandjaitan @Amien__Rais @RidhoRahmadi85 @say_ulva @KPU_ID Max Moein,DKI JAKARTA
2022-12-25 20:04:00,AnisaLes1209,#aniesbaswedan #ridwankamil #sandiagauno #jokowi #capres #cawapres #puanmaharani #cakimin  #indonesia #exploresukabumi #kotasukabumi #infosukabumi #visitcianjur #sukabumitoday #explorecianjur #infocianjur #ciracap #caringin #cibadak #cisaat,DKI JAKARTA
