date,username,tweet,location
2022-12-25 19:44:50,iwandermawan63,@SantorinisSun Selamat Natal......damai yaaaa.... Baik2 saja @aniesbaswedan,DKI JAKARTA
2022-12-25 19:43:13,GeryNelwan,"Forum Masyarakat Soloraya Gelar Aksi Tolak Kedatangan Anies Baswedan, Bentangkan Spanduk Bapak Politik Identitas #BapakPolitikIndentitas #TolakAnies   https://t.co/v33JsQZr6i",DKI JAKARTA
2022-12-25 19:42:49,GeryNelwan,Warga Lakukan Aksi Demo Tolak Kedatangan Anies Baswedan #BapakPolitikIndentitas #TolakAnies  https://t.co/MzEvHxNumf,DKI JAKARTA
2022-12-25 19:27:07,mariakartika55,rakyat semakin solid untuk menolak berbagai kegiatan safari politik Anies Baswedan.  https://t.co/cV7sxPqu3r,DKI JAKARTA
2022-12-25 19:26:14,mariakartika55,satukan suara tolak kampenye Anies Baswedan dimanapun❌❌  https://t.co/xRFMy9Bqnw,DKI JAKARTA
2022-12-25 19:24:52,Gigihpramon0,Anies Baswedan sudah offside dan telah memberikan contoh buruk berupa sikap curi start kampanye Pemilu 2024. #TolakAnies  https://t.co/1UBtXv0ej1,DKI JAKARTA
2022-12-25 19:19:52,alexandreanov,@ZettaZahra2 @aniesbaswedan Jelas beda.. Gk level ..,DKI JAKARTA
2022-12-25 19:03:24,GeryNelwan,Anies kinerjanya bobrok hancur berantakan - Tolak Anies Baswedan - #HTIFPIDukungAnies #AniesDidukungKHILAFAH #AniesNasdemOut  #TenggelamkanAniesBaswedan #TenggelamkanPartaiNasdem #GoodByeNasdemAnies #AniesDidukungKoruptor #AniesPendukungKhilafah #AniesPendukungOrmasRadikal  https://t.co/zjvjcvEuuk,DKI JAKARTA
